{
  "$schema": "https://json-schema.org/draft/2020-12/schema",
  "$id": "qsl.gcp_kms_policy_root.v1",
  "title": "QSL GCP KMS P-256 Policy Root v1",
  "description": "A public Cloud KMS P-256 verification root. It contains no KMS credentials, no private key, and grants no runtime authority by itself.",
  "type": "object",
  "additionalProperties": false,
  "required": ["schema", "root_id", "created_at", "effective_at", "expires_at", "digest_algorithm", "kms_key_version", "signature_algorithm", "public_key_pem", "public_key_sha256", "trusted_policy_root_sha256"],
  "properties": {
    "schema": {"const": "qsl.gcp_kms_policy_root.v1"},
    "root_id": {"$ref": "#/$defs/identity"},
    "created_at": {"$ref": "#/$defs/timestamp"},
    "effective_at": {"$ref": "#/$defs/timestamp"},
    "expires_at": {"$ref": "#/$defs/timestamp"},
    "digest_algorithm": {"const": "sha256"},
    "kms_key_version": {"type": "string", "pattern": "^projects/[a-z][a-z0-9-]{4,28}[a-z0-9]/locations/[a-z0-9-]+/keyRings/[A-Za-z0-9_-]{1,63}/cryptoKeys/[A-Za-z0-9_-]{1,63}/cryptoKeyVersions/[1-9][0-9]*$"},
    "signature_algorithm": {"const": "EC_SIGN_P256_SHA256"},
    "public_key_pem": {"type": "string", "pattern": "^-----BEGIN PUBLIC KEY-----\\n"},
    "public_key_sha256": {"$ref": "#/$defs/sha256"},
    "trusted_policy_root_sha256": {"$ref": "#/$defs/sha256"}
  },
  "$defs": {
    "identity": {"type": "string", "pattern": "^[a-z][a-z0-9]*(?:[._-][a-z0-9]+)*$"},
    "sha256": {"type": "string", "pattern": "^[0-9a-f]{64}$"},
    "timestamp": {"type": "string", "format": "date-time", "pattern": "^[0-9]{4}-[0-9]{2}-[0-9]{2}T[0-9]{2}:[0-9]{2}:[0-9]{2}Z$"}
  }
}
