{
  "created_at": "2026-08-19T02:35:49Z",
  "digest_algorithm": "sha256",
  "effective_at": "2026-08-19T02:35:49Z",
  "expires_at": "2027-08-19T02:35:49Z",
  "kms_key_version": "projects/qslresearchquant/locations/global/keyRings/qsl-p0-policy-root/cryptoKeys/autonomy-policy-root-v1/cryptoKeyVersions/1",
  "public_key_pem": "-----BEGIN PUBLIC KEY-----\nMFkwEwYHKoZIzj0CAQYIKoZIzj0DAQcDQgAEUbq/zI1gufE5N5C5rjvXGezK5ELL\n1gXkFlMLIz7Kw7a8ESwQhbxv+FzzOXlYfa/vPviDsCthEefOdgKBCwnJEA==\n-----END PUBLIC KEY-----\n",
  "public_key_sha256": "91bd603d3c226b75e9b7ccabf7a0cbe0f2d667a58e949102c170380021fcbd62",
  "root_id": "qsl-qslresearchquant-p0-root-v1",
  "schema": "qsl.gcp_kms_policy_root.v1",
  "signature_algorithm": "EC_SIGN_P256_SHA256",
  "trusted_policy_root_sha256": "22c74c37080d93fefcbcffb91d8862fb2d9a4f3dc81d21d6e7055ebc1b93e7d3"
}
