{
  "created_at": "2026-08-19T02:27:41Z",
  "digest_algorithm": "sha256",
  "effective_at": "2026-08-19T02:27:41Z",
  "expires_at": "2027-08-19T02:27:41Z",
  "kms_key_version": "projects/charlesschwabquant/locations/global/keyRings/qsl-p0-policy-root/cryptoKeys/autonomy-policy-root-v1/cryptoKeyVersions/1",
  "public_key_pem": "-----BEGIN PUBLIC KEY-----\nMFkwEwYHKoZIzj0CAQYIKoZIzj0DAQcDQgAExSruuEMFzKQs92oYaBjm1He7HwHC\n0d4/RHQ9R37PWAiQ59rDyhQDfMTpUitzMWNirXoVVU8sGsIiAPql4ex/mQ==\n-----END PUBLIC KEY-----\n",
  "public_key_sha256": "fa3e0f55108ed93307819e643e1609849f5a7e4d6320b1e6ba4a8965cec82c51",
  "root_id": "qsl-charlesschwabquant-p0-root-v1",
  "schema": "qsl.gcp_kms_policy_root.v1",
  "signature_algorithm": "EC_SIGN_P256_SHA256",
  "trusted_policy_root_sha256": "04ce4018a6cbac4a2fa0d5d2b3b0951312a845dd4e64252c8426ad8c5d5f3a12"
}
